id,text
1,"Artificial intelligence is transforming the world by enabling machines to learn from data, recognize patterns, and make decisions with minimal human intervention."
2,"Machine learning models are used in healthcare to predict patient outcomes, optimize treatment plans, and improve overall quality of care."
3,"The rise of renewable energy sources such as solar and wind power is crucial for reducing carbon emissions and combating climate change."
4,"Blockchain technology provides a secure and decentralized way to record transactions, enabling cryptocurrencies and smart contracts to function."
5,"Natural language processing allows computers to understand human language, enabling applications such as chatbots, translation, and sentiment analysis."
6,"Autonomous vehicles rely on a combination of sensors, AI algorithms, and real-time data processing to navigate safely without human drivers."
7,"Big data analytics allows organizations to extract meaningful insights from large datasets, improving decision-making and business efficiency."
8,"Cybersecurity is becoming increasingly important as more devices connect to the internet, creating vulnerabilities that hackers can exploit."
9,"Cloud computing provides scalable and flexible IT infrastructure, enabling businesses to store, process, and access data over the internet."
10,"Virtual reality and augmented reality technologies are revolutionizing gaming, education, and remote collaboration by creating immersive experiences."
11,"Quantum computing has the potential to solve complex problems that are currently infeasible for classical computers, especially in cryptography and optimization."
12,"E-commerce platforms use recommendation engines powered by AI to suggest products, increasing customer engagement and driving sales."
13,"The Internet of Things connects everyday objects to the internet, allowing them to send and receive data to improve efficiency and convenience."
14,"Data privacy regulations, such as GDPR, protect user data by enforcing rules on how personal information can be collected, stored, and shared."
15,"Robotics is advancing rapidly, enabling machines to perform tasks in manufacturing, logistics, and healthcare that previously required human labor."
16,"Deep learning techniques, such as neural networks, are used in image recognition, speech processing, and natural language understanding."
17,"Electric vehicles are becoming more popular due to advancements in battery technology, environmental concerns, and government incentives."
18,"Social media platforms use AI algorithms to curate content, personalize user feeds, and target advertisements more effectively."
19,"Edge computing processes data near the source of data generation, reducing latency and improving real-time analytics performance."
20,"3D printing technology allows the creation of complex objects layer by layer, revolutionizing manufacturing, prototyping, and medical applications."
21,"Education technology leverages AI and digital tools to personalize learning experiences, track progress, and improve student outcomes."
22,"Healthcare data analytics uses machine learning to predict disease outbreaks, monitor patient health, and optimize hospital resources."
23,"Smart cities integrate IoT devices, data analytics, and AI to improve urban infrastructure, transportation, and energy management."
24,"Financial technology, or fintech, is transforming banking and payments by enabling faster, cheaper, and more secure financial services."
25,"Climate modeling uses supercomputers and AI to simulate future environmental scenarios, helping policymakers make informed decisions."
